### ISSUE TITLE
daprd stuck trying to connect to the app port

### ISSUE THREAD

**Issue by adrianlzt** [dapr/dapr#703]
## In what area(s)?

/area runtime

## What version of Dapr?

0.1.0

## Expected Behavior
daprd should detect the app port correctly and continue the initialisation.

## Actual Behavior
daprd is stuck trying to connect to the app port, saturating the DNS server.

## Steps to Reproduce the Problem
I have deployed the calculator frontend (from example 3):
```
kubectl apply -f deploy/react-calculator.yaml
```

The last line shown in the dapr sidecar container:
```
time="2019-10-29T11:19:40Z" level=info msg="application protocol: http. waiting on port 8080" 
```

Using tcpdump inside the network namespace of the dapr container:
```
12:21:37.077598 IP 10.96.0.10.53 > 10.244.0.19.40102: 48207 ServFail- 0/0/0 (50)
12:21:37.077599 IP 10.96.0.10.53 > 10.244.0.19.35928: 44869 ServFail- 0/0/0 (50)
12:21:37.129220 IP 10.244.0.19.52488 > 10.96.0.10.53: 22461+ AAAA? localhost.default.svc.cluster.local. (53)
12:21:37.129256 IP 10.244.0.19.42309 > 10.96.0.10.53: 33812+ A? localhost.default.svc.cluster.local. (53)
12:21:37.129403 IP 10.96.0.10.53 > 10.244.0.19.52488: 22461 NXDomain- 0/1/0 (146)
12:21:37.129406 IP 10.96.0.10.53 > 10.244.0.19.42309: 33812 NXDomain- 0/1/0 (146)
12:21:37.129584 IP 10.244.0.19.48544 > 10.96.0.10.53: 18105+ AAAA? localhost.svc.cluster.local. (45)
12:21:37.129612 IP 10.244.0.19.44603 > 10.96.0.10.53: 28271+ A? localhost.svc.cluster.local. (45)
12:21:37.129750 IP 10.96.0.10.53 > 10.244.0.19.48544: 18105 NXDomain- 0/1/0 (138)
12:21:37.129766 IP 10.96.0.10.53 > 10.244.0.19.44603: 28271 NXDomain- 0/1/0 (138)
12:21:37.129921 IP 10.244.0.19.60791 > 10.96.0.10.53: 27251+ A? localhost.cluster.local. (41)
12:21:37.129942 IP 10.244.0.19.39028 > 10.96.0.10.53: 55312+ AAAA? localhost.cluster.local. (41)
12:21:37.130045 IP 10.96.0.10.53 > 10.244.0.19.60791: 27251 NXDomain- 0/1/0 (134)
12:21:37.130080 IP 10.96.0.10.53 > 10.244.0.19.39028: 55312 NXDomain- 0/1/0 (134)
12:21:37.130247 IP 10.244.0.19.36803 > 10.96.0.10.53: 82+ AAAA? localhost.es.wcorp.com. (50)
12:21:37.130268 IP 10.244.0.19.34154 > 10.96.0.10.53: 39268+ A? localhost.es.wcorp.com. (50)
```

In the ``/etc/resolv.conf`` of the dapr container I have:
```
search default.svc.cluster.local svc.cluster.local cluster.local es.wcorp.com example.com
nameserver 10.96.0.10
options ndots:5
```

The last two are from the ``/etc/resolv.conf`` in the host.

From what I see, looks like the go resolver is trying to resolve some ``localhost.*`` domains, not being able to get any IP address and just looping.

Meanwhile, the dnsmasq in the host is consuming a 30% of one CPU.

Maybe ``localhost`` [here](https://github.com/dapr/dapr/blob/master/pkg/runtime/runtime.go#L839) should be changed to ``localhost.``? I haven't tried.

And maybe the loop sleep should be increased?

**Comment by LMWF** [comment]
@adrianlzt - did daprd ever end up connecting or was it stuck forever?

Also, was the user app (the calculator) up?

**Comment by LMWF** [comment]
@adrianlzt - any update on the questions I asked above?

**Comment by adrianlzt** [comment]
It was stuck forever.
I didn't test anymore

**Comment by amanbha** [comment]
@adrianlzt Closing this issue, please feel free to open if you are still facing issue.
